"","Gene","Annotation","Non.unique.Gene.name","sg_change_0","sg_change_1","ratio","gene.annotate","phage","hypothetical","transposase","caps","exclude"
"707","atpF","proton-translocating ATPase F0 sector subunit b","",8,50,1.03305785123967,"ATPF PROTON-TRANSLOCATING ATPASE F0 SECTOR SUBUNIT B ",FALSE,FALSE,FALSE,0,0
"708","group_17362","proton-translocating ATPase F0 sector subunit b","atpF",8,50,1.03305785123967,"GROUP_17362 PROTON-TRANSLOCATING ATPASE F0 SECTOR SUBUNIT B ATPF",FALSE,FALSE,FALSE,0,0
"709","group_3680","acetyltransferase GNAT family protein","ydaF_2",4,25,1.03305785123967,"GROUP_3680 ACETYLTRANSFERASE GNAT FAMILY PROTEIN YDAF_2",FALSE,FALSE,FALSE,0,0
"710","murZ","acetyltransferase","",4,25,1.03305785123967,"MURZ ACETYLTRANSFERASE ",FALSE,FALSE,FALSE,0,0
"711","group_7863","glycerol kinase","glpK",5,31,1.02479338842975,"GROUP_7863 GLYCEROL KINASE GLPK",FALSE,FALSE,FALSE,0,0
"712","group_12836","ferric cations import ATP-binding protein FbpC","potA_2",6,37,1.01928374655647,"GROUP_12836 FERRIC CATIONS IMPORT ATP-BINDING PROTEIN FBPC POTA_2",FALSE,FALSE,FALSE,0,0
"713","group_8769","phosphomethylpyrimidine kinase","pdxK",6,37,1.01928374655647,"GROUP_8769 PHOSPHOMETHYLPYRIMIDINE KINASE PDXK",FALSE,FALSE,FALSE,0,0
"714","pdxK","phosphomethylpyrimidine kinase","",6,37,1.01928374655647,"PDXK PHOSPHOMETHYLPYRIMIDINE KINASE ",FALSE,FALSE,FALSE,0,0
"715","group_9045","thioredoxin","resA",8,49,1.01239669421488,"GROUP_9045 THIOREDOXIN RESA",FALSE,FALSE,FALSE,0,0
"716","lepA","GTP-binding protein LepA","",8,48,0.991735537190083,"LEPA GTP-BINDING PROTEIN LEPA ",FALSE,FALSE,FALSE,0,0
"717","hexA","DNA mismatch repair protein MutS","",6,36,0.991735537190083,"HEXA DNA MISMATCH REPAIR PROTEIN MUTS ",FALSE,FALSE,FALSE,0,0
"718","group_10467","glutamine amidotransferase class I","",5,30,0.991735537190083,"GROUP_10467 GLUTAMINE AMIDOTRANSFERASE CLASS I ",FALSE,FALSE,FALSE,0,0
"719","group_7804","DNA polymerase IV","dinP",5,30,0.991735537190083,"GROUP_7804 DNA POLYMERASE IV DINP",FALSE,FALSE,FALSE,0,0
"720","group_10468","glutamine amidotransferase class I","",4,24,0.991735537190083,"GROUP_10468 GLUTAMINE AMIDOTRANSFERASE CLASS I ",FALSE,FALSE,FALSE,0,0
"721","group_12187","carbohydrate kinase PfkB family","iolC",4,24,0.991735537190083,"GROUP_12187 CARBOHYDRATE KINASE PFKB FAMILY IOLC",FALSE,FALSE,FALSE,0,0
"722","group_12786","tRNA (uracil-5-)-methyltransferase Gid","gidA_2",4,24,0.991735537190083,"GROUP_12786 TRNA (URACIL-5-)-METHYLTRANSFERASE GID GIDA_2",FALSE,FALSE,FALSE,0,0
"723","group_14698","methionyl aminopeptidase","map",4,24,0.991735537190083,"GROUP_14698 METHIONYL AMINOPEPTIDASE MAP",FALSE,FALSE,FALSE,0,0
"724","group_2262","gp24","",4,24,0.991735537190083,"GROUP_2262 GP24 ",FALSE,FALSE,FALSE,0,0
"725","group_4177","competence factor transport protein ComB","comB",4,24,0.991735537190083,"GROUP_4177 COMPETENCE FACTOR TRANSPORT PROTEIN COMB COMB",FALSE,FALSE,FALSE,0,0
"726","group_9247","glycerophosphoryl diester phosphodiesterase","glpQ2",4,24,0.991735537190083,"GROUP_9247 GLYCEROPHOSPHORYL DIESTER PHOSPHODIESTERASE GLPQ2",FALSE,FALSE,FALSE,0,0
"727","iolC","carbohydrate kinase PfkB family","",4,24,0.991735537190083,"IOLC CARBOHYDRATE KINASE PFKB FAMILY ",FALSE,FALSE,FALSE,0,0
"728","map","methionyl aminopeptidase","",4,24,0.991735537190083,"MAP METHIONYL AMINOPEPTIDASE ",FALSE,FALSE,FALSE,0,0
"729","pgdA","peptidoglycan N-acetylglucosamine deacetylase A","",4,24,0.991735537190083,"PGDA PEPTIDOGLYCAN N-ACETYLGLUCOSAMINE DEACETYLASE A ",FALSE,FALSE,FALSE,0,0
"730","ssuB","multidrug ABC transporter ATPase","",4,24,0.991735537190083,"SSUB MULTIDRUG ABC TRANSPORTER ATPASE ",FALSE,FALSE,FALSE,0,0
"731","gla","glycerol facilitator-aquaporin","",3,18,0.991735537190083,"GLA GLYCEROL FACILITATOR-AQUAPORIN ",FALSE,FALSE,FALSE,0,0
"732","group_11954","pneumococcal histidine triad protein E (Bvh-3)","phtE",3,18,0.991735537190083,"GROUP_11954 PNEUMOCOCCAL HISTIDINE TRIAD PROTEIN E (BVH-3) PHTE",FALSE,FALSE,FALSE,0,0
"733","group_13364","PTS system mannose/fructose/N-acetylgalactosamine-specific transporter subunit IID","manZ_3",3,18,0.991735537190083,"GROUP_13364 PTS SYSTEM MANNOSE/FRUCTOSE/N-ACETYLGALACTOSAMINE-SPECIFIC TRANSPORTER SUBUNIT IID MANZ_3",FALSE,FALSE,FALSE,0,0
"734","group_2073","competence-specific global transcription modulator","nusG",3,18,0.991735537190083,"GROUP_2073 COMPETENCE-SPECIFIC GLOBAL TRANSCRIPTION MODULATOR NUSG",FALSE,FALSE,FALSE,0,0
"735","group_3410","L-lactate oxidase","lctO",3,18,0.991735537190083,"GROUP_3410 L-LACTATE OXIDASE LCTO",FALSE,FALSE,FALSE,0,0
"736","group_4102","ABC transporter membrane-spanning protein","",3,18,0.991735537190083,"GROUP_4102 ABC TRANSPORTER MEMBRANE-SPANNING PROTEIN ",FALSE,FALSE,FALSE,0,0
"737","group_6268","acetyltransferase","",3,18,0.991735537190083,"GROUP_6268 ACETYLTRANSFERASE ",FALSE,FALSE,FALSE,0,0
"738","group_6762","major tail protein","",3,18,0.991735537190083,"GROUP_6762 MAJOR TAIL PROTEIN ",FALSE,FALSE,FALSE,0,0
"739","group_7862","glycerol kinase","glpK",3,18,0.991735537190083,"GROUP_7862 GLYCEROL KINASE GLPK",FALSE,FALSE,FALSE,0,0
"740","hlyB","multidrug resistance protein 1 (ATP-binding cassettesub-family B member 1) (P-glycoprotein 1)(antigen)","",3,18,0.991735537190083,"HLYB MULTIDRUG RESISTANCE PROTEIN 1 (ATP-BINDING CASSETTESUB-FAMILY B MEMBER 1) (P-GLYCOPROTEIN 1)(ANTIGEN) ",FALSE,FALSE,FALSE,0,0
"741","group_11093","maltodextrin ABC transporter permease","malG",2,12,0.991735537190083,"GROUP_11093 MALTODEXTRIN ABC TRANSPORTER PERMEASE MALG",FALSE,FALSE,FALSE,0,0
"742","group_12572","penicillin-binding protein 2A","pbp2a",2,12,0.991735537190083,"GROUP_12572 PENICILLIN-BINDING PROTEIN 2A PBP2A",FALSE,FALSE,FALSE,0,0
"743","group_12642","Cof family protein","yidA_2",2,12,0.991735537190083,"GROUP_12642 COF FAMILY PROTEIN YIDA_2",FALSE,FALSE,FALSE,0,0
"744","group_1309","TMP repeat family","yqbO",2,12,0.991735537190083,"GROUP_1309 TMP REPEAT FAMILY YQBO",FALSE,FALSE,FALSE,0,0
"745","group_14779","conserved structural protein putative","",2,12,0.991735537190083,"GROUP_14779 CONSERVED STRUCTURAL PROTEIN PUTATIVE ",FALSE,FALSE,FALSE,0,0
"746","group_17765","cro-like protein","",2,12,0.991735537190083,"GROUP_17765 CRO-LIKE PROTEIN ",FALSE,FALSE,FALSE,0,0
"747","group_20858","DNA complete genome","",2,12,0.991735537190083,"GROUP_20858 DNA COMPLETE GENOME ",FALSE,FALSE,FALSE,0,0
"748","group_5298","polar amino acid ABC transporter ATPase","glnQ_2",2,12,0.991735537190083,"GROUP_5298 POLAR AMINO ACID ABC TRANSPORTER ATPASE GLNQ_2",FALSE,FALSE,FALSE,0,0
"749","group_5420","transporter major facilitator family protein","",2,12,0.991735537190083,"GROUP_5420 TRANSPORTER MAJOR FACILITATOR FAMILY PROTEIN ",FALSE,FALSE,FALSE,0,0
"750","group_6230","Phage protein","",2,12,0.991735537190083,"GROUP_6230 PHAGE PROTEIN ",FALSE,FALSE,FALSE,0,0
"751","group_6563","gp15","",2,12,0.991735537190083,"GROUP_6563 GP15 ",FALSE,FALSE,FALSE,0,0
"752","group_8267","major facilitator superfamily permease","",2,12,0.991735537190083,"GROUP_8267 MAJOR FACILITATOR SUPERFAMILY PERMEASE ",FALSE,FALSE,FALSE,0,0
"753","group_9367","integral membrane protein","",2,12,0.991735537190083,"GROUP_9367 INTEGRAL MEMBRANE PROTEIN ",FALSE,FALSE,FALSE,0,0
"754","malG","maltodextrin ABC transporter permease","",2,12,0.991735537190083,"MALG MALTODEXTRIN ABC TRANSPORTER PERMEASE ",FALSE,FALSE,FALSE,0,0
"755","mcrB","McrBC 5-methylcytosine restriction system component","",2,12,0.991735537190083,"MCRB MCRBC 5-METHYLCYTOSINE RESTRICTION SYSTEM COMPONENT ",FALSE,FALSE,FALSE,0,0
"756","ndvA","ABC transporter ATP-binding protein","",2,12,0.991735537190083,"NDVA ABC TRANSPORTER ATP-BINDING PROTEIN ",FALSE,FALSE,FALSE,0,0
"757","pbp2a","penicillin-binding protein 2A","",2,12,0.991735537190083,"PBP2A PENICILLIN-BINDING PROTEIN 2A ",FALSE,FALSE,FALSE,0,0
"758","pcp-truncation_1","pyrrolidone carboxyl peptidase truncation","",2,12,0.991735537190083,"PCP-TRUNCATION_1 PYRROLIDONE CARBOXYL PEPTIDASE TRUNCATION ",FALSE,FALSE,FALSE,0,0
"759","rarA","chromosome segregation helicase ATPase AAA family","",2,12,0.991735537190083,"RARA CHROMOSOME SEGREGATION HELICASE ATPASE AAA FAMILY ",FALSE,FALSE,FALSE,0,0
"760","yidA_2","Cof family protein","",2,12,0.991735537190083,"YIDA_2 COF FAMILY PROTEIN ",FALSE,FALSE,FALSE,0,0
"761","ftsH_2","competence-specific global transcription modulator","",8,47,0.971074380165289,"FTSH_2 COMPETENCE-SPECIFIC GLOBAL TRANSCRIPTION MODULATOR ",FALSE,FALSE,FALSE,0,0
"762","group_6411","30S ribosomal protein S4","rpsD",8,47,0.971074380165289,"GROUP_6411 30S RIBOSOMAL PROTEIN S4 RPSD",FALSE,FALSE,FALSE,0,0
"763","group_8241","glycosyltransferase involved in cell wall biogenesis","",6,35,0.964187327823691,"GROUP_8241 GLYCOSYLTRANSFERASE INVOLVED IN CELL WALL BIOGENESIS ",FALSE,FALSE,FALSE,0,0
"764","group_6620","DNA modification methyltransferase M.XbaI","yhdJ",5,29,0.958677685950413,"GROUP_6620 DNA MODIFICATION METHYLTRANSFERASE M.XBAI YHDJ",FALSE,FALSE,FALSE,0,0
"765","group_8363","methyltransferase","",5,29,0.958677685950413,"GROUP_8363 METHYLTRANSFERASE ",FALSE,FALSE,FALSE,0,0
"766","hin","site-specific recombinase/resolvase","",5,29,0.958677685950413,"HIN SITE-SPECIFIC RECOMBINASE/RESOLVASE ",FALSE,FALSE,FALSE,0,0
"767","speA","ornithine decarboxylase family protein","",9,52,0.955004591368228,"SPEA ORNITHINE DECARBOXYLASE FAMILY PROTEIN ",FALSE,FALSE,FALSE,0,0
"768","comFA","helicase ComFA","",4,23,0.950413223140496,"COMFA HELICASE COMFA ",FALSE,FALSE,FALSE,0,0
"769","group_10788","single-strand binding protein family","ssb",4,23,0.950413223140496,"GROUP_10788 SINGLE-STRAND BINDING PROTEIN FAMILY SSB",FALSE,FALSE,FALSE,0,0
"770","group_5323","transporter major facilitator family protein","",4,23,0.950413223140496,"GROUP_5323 TRANSPORTER MAJOR FACILITATOR FAMILY PROTEIN ",FALSE,FALSE,FALSE,0,0
"771","group_9233","Cof family protein","yidA_3",4,23,0.950413223140496,"GROUP_9233 COF FAMILY PROTEIN YIDA_3",FALSE,FALSE,FALSE,0,0
"772","iga_1","surface protein (fragment)","",4,23,0.950413223140496,"IGA_1 SURFACE PROTEIN (FRAGMENT) ",FALSE,FALSE,FALSE,0,0
"773","phtE","pneumococcal histidine triad protein E","",4,23,0.950413223140496,"PHTE PNEUMOCOCCAL HISTIDINE TRIAD PROTEIN E ",FALSE,FALSE,FALSE,0,0
"774","yidA_3","Cof family protein","",4,23,0.950413223140496,"YIDA_3 COF FAMILY PROTEIN ",FALSE,FALSE,FALSE,0,0
"775","group_14296","X-Pro dipeptidase","pepQ",6,34,0.9366391184573,"GROUP_14296 X-PRO DIPEPTIDASE PEPQ",FALSE,FALSE,FALSE,0,0
"776","pepQ","X-Pro dipeptidase","",6,34,0.9366391184573,"PEPQ X-PRO DIPEPTIDASE ",FALSE,FALSE,FALSE,0,0
"777","group_199","choline binding protein A","cbpA",3,17,0.9366391184573,"GROUP_199 CHOLINE BINDING PROTEIN A CBPA",FALSE,FALSE,FALSE,0,0
"778","group_3634","PEP-utilizing enzyme family protein","ppsA",3,17,0.9366391184573,"GROUP_3634 PEP-UTILIZING ENZYME FAMILY PROTEIN PPSA",FALSE,FALSE,FALSE,0,0
"779","group_6898","membrane protein","",3,17,0.9366391184573,"GROUP_6898 MEMBRANE PROTEIN ",FALSE,FALSE,FALSE,0,0
"780","tcyA","ABC transporter substrate-binding lipoprotein","",3,17,0.9366391184573,"TCYA ABC TRANSPORTER SUBSTRATE-BINDING LIPOPROTEIN ",FALSE,FALSE,FALSE,0,0
"781","group_8719","serine/threonine protein phosphatase","pphA",8,45,0.929752066115702,"GROUP_8719 SERINE/THREONINE PROTEIN PHOSPHATASE PPHA",FALSE,FALSE,FALSE,0,0
"782","group_1490","putative antireceptor","",5,28,0.925619834710744,"GROUP_1490 PUTATIVE ANTIRECEPTOR ",FALSE,FALSE,FALSE,0,0
"783","group_16302","phenylalanyl-tRNA synthetase alpha chain","pheS",5,28,0.925619834710744,"GROUP_16302 PHENYLALANYL-TRNA SYNTHETASE ALPHA CHAIN PHES",FALSE,FALSE,FALSE,0,0
"784","group_2027","protein LacX plasmid","nanA_2",5,28,0.925619834710744,"GROUP_2027 PROTEIN LACX PLASMID NANA_2",FALSE,FALSE,FALSE,0,0
"785","pheS","phenylalanyl-tRNA synthetase alpha chain","",5,28,0.925619834710744,"PHES PHENYLALANYL-TRNA SYNTHETASE ALPHA CHAIN ",FALSE,FALSE,FALSE,0,0
"786","group_9246","glycerophosphoryl diester phosphodiesterase","glpQ2",6,33,0.909090909090909,"GROUP_9246 GLYCEROPHOSPHORYL DIESTER PHOSPHODIESTERASE GLPQ2",FALSE,FALSE,FALSE,0,0
"787","group_2610","beta-galactosidase","lacZ",4,22,0.909090909090909,"GROUP_2610 BETA-GALACTOSIDASE LACZ",FALSE,FALSE,FALSE,0,0
"788","group_4062","competence factor transporting ATP-binding protein/permease ComA","comA",4,22,0.909090909090909,"GROUP_4062 COMPETENCE FACTOR TRANSPORTING ATP-BINDING PROTEIN/PERMEASE COMA COMA",FALSE,FALSE,FALSE,0,0
"789","group_4735","glyoxalase","",4,22,0.909090909090909,"GROUP_4735 GLYOXALASE ",FALSE,FALSE,FALSE,0,0
"790","fliY","ABC transporter substrate binding lipoprotein-amino acid transport","",2,11,0.909090909090909,"FLIY ABC TRANSPORTER SUBSTRATE BINDING LIPOPROTEIN-AMINO ACID TRANSPORT ",FALSE,FALSE,FALSE,0,0
"791","fucI","L-fucose isomerase","",2,11,0.909090909090909,"FUCI L-FUCOSE ISOMERASE ",FALSE,FALSE,FALSE,0,0
"792","group_10078","chromosome segregation helicase ATPase AAA family","rarA",2,11,0.909090909090909,"GROUP_10078 CHROMOSOME SEGREGATION HELICASE ATPASE AAA FAMILY RARA",FALSE,FALSE,FALSE,0,0
"793","group_11133","restriction endonuclease R.XbaI","",2,11,0.909090909090909,"GROUP_11133 RESTRICTION ENDONUCLEASE R.XBAI ",FALSE,FALSE,FALSE,0,0
"794","group_11811","ABC transporter ATP-binding protein","metN",2,11,0.909090909090909,"GROUP_11811 ABC TRANSPORTER ATP-BINDING PROTEIN METN",FALSE,FALSE,FALSE,0,0
"795","group_13012","DNA polymerase III delta' subunit","holB",2,11,0.909090909090909,"GROUP_13012 DNA POLYMERASE III DELTA' SUBUNIT HOLB",FALSE,FALSE,FALSE,0,0
"796","group_13388","serine/threonine protein phosphatase","",2,11,0.909090909090909,"GROUP_13388 SERINE/THREONINE PROTEIN PHOSPHATASE ",FALSE,FALSE,FALSE,0,0
"797","group_14979","restriction enzyme","sau3AIR",2,11,0.909090909090909,"GROUP_14979 RESTRICTION ENZYME SAU3AIR",FALSE,FALSE,FALSE,0,0
"798","group_15969","biotin carboxylase","",2,11,0.909090909090909,"GROUP_15969 BIOTIN CARBOXYLASE ",FALSE,FALSE,FALSE,0,0
"799","group_17099","Chromosome segregation ATPase","",2,11,0.909090909090909,"GROUP_17099 CHROMOSOME SEGREGATION ATPASE ",FALSE,FALSE,FALSE,0,0
"800","group_20696","DUF218 domain","",2,11,0.909090909090909,"GROUP_20696 DUF218 DOMAIN ",FALSE,FALSE,FALSE,0,0
"801","group_2366","hyaluronidase","hysA",2,11,0.909090909090909,"GROUP_2366 HYALURONIDASE HYSA",FALSE,FALSE,FALSE,0,0
"802","group_2507","iron ABC transporter permease","ydcU",2,11,0.909090909090909,"GROUP_2507 IRON ABC TRANSPORTER PERMEASE YDCU",FALSE,FALSE,FALSE,0,0
"803","group_2562","choline binding protein E CbpE","lytB_3",2,11,0.909090909090909,"GROUP_2562 CHOLINE BINDING PROTEIN E CBPE LYTB_3",FALSE,FALSE,FALSE,0,0
"804","group_2665","McrBC 5-methylcytosine restriction system component","leuA",2,11,0.909090909090909,"GROUP_2665 MCRBC 5-METHYLCYTOSINE RESTRICTION SYSTEM COMPONENT LEUA",FALSE,FALSE,FALSE,0,0
"805","group_3409","L-lactate oxidase","lctO",2,11,0.909090909090909,"GROUP_3409 L-LACTATE OXIDASE LCTO",FALSE,FALSE,FALSE,0,0
"806","group_4064","competence factor transporting ATP-binding protein/permease ComA","comA",2,11,0.909090909090909,"GROUP_4064 COMPETENCE FACTOR TRANSPORTING ATP-BINDING PROTEIN/PERMEASE COMA COMA",FALSE,FALSE,FALSE,0,0
"807","group_4134","Lmo2277 protein","",2,11,0.909090909090909,"GROUP_4134 LMO2277 PROTEIN ",FALSE,FALSE,FALSE,0,0
"808","group_4186","competence factor transport protein ComB","comB",2,11,0.909090909090909,"GROUP_4186 COMPETENCE FACTOR TRANSPORT PROTEIN COMB COMB",FALSE,FALSE,FALSE,0,0
"809","group_427","mobile genetic element","IS1381-truncation",2,11,0.909090909090909,"GROUP_427 MOBILE GENETIC ELEMENT IS1381-TRUNCATION",FALSE,FALSE,FALSE,0,0
"810","group_4368","glycerate kinase","glxK",2,11,0.909090909090909,"GROUP_4368 GLYCERATE KINASE GLXK",FALSE,FALSE,FALSE,0,0
"811","group_4894","endonuclease/exonuclease/phosphatase family","",2,11,0.909090909090909,"GROUP_4894 ENDONUCLEASE/EXONUCLEASE/PHOSPHATASE FAMILY ",FALSE,FALSE,FALSE,0,0
"812","group_5459","zinc-containing alcohol dehydrogenase","xylB",2,11,0.909090909090909,"GROUP_5459 ZINC-CONTAINING ALCOHOL DEHYDROGENASE XYLB",FALSE,FALSE,FALSE,0,0
"813","group_6088","translation factor","",2,11,0.909090909090909,"GROUP_6088 TRANSLATION FACTOR ",FALSE,FALSE,FALSE,0,0
"814","group_6171","Pneumococcal histidine triad protein D precursor","",2,11,0.909090909090909,"GROUP_6171 PNEUMOCOCCAL HISTIDINE TRIAD PROTEIN D PRECURSOR ",FALSE,FALSE,FALSE,0,0
"815","group_6178","ATP-dependent Clp protease ATP-binding subunit","clpE",2,11,0.909090909090909,"GROUP_6178 ATP-DEPENDENT CLP PROTEASE ATP-BINDING SUBUNIT CLPE",FALSE,FALSE,FALSE,0,0
"816","group_6634","polyribonucleotide nucleotidyltransferase","pnpA",2,11,0.909090909090909,"GROUP_6634 POLYRIBONUCLEOTIDE NUCLEOTIDYLTRANSFERASE PNPA",FALSE,FALSE,FALSE,0,0
"817","group_6759","major tail protein","",2,11,0.909090909090909,"GROUP_6759 MAJOR TAIL PROTEIN ",FALSE,FALSE,FALSE,0,0
"818","group_7390","maltodextrin ABC transporter permease","malF",2,11,0.909090909090909,"GROUP_7390 MALTODEXTRIN ABC TRANSPORTER PERMEASE MALF",FALSE,FALSE,FALSE,0,0
"819","group_7426","response regulator","adaA",2,11,0.909090909090909,"GROUP_7426 RESPONSE REGULATOR ADAA",FALSE,FALSE,FALSE,0,0
"820","group_7608","adenine-specific methyltransferase","yhdJ_2",2,11,0.909090909090909,"GROUP_7608 ADENINE-SPECIFIC METHYLTRANSFERASE YHDJ_2",FALSE,FALSE,FALSE,0,0
"821","group_7722","caax amino protease family protein","",2,11,0.909090909090909,"GROUP_7722 CAAX AMINO PROTEASE FAMILY PROTEIN ",FALSE,FALSE,FALSE,0,0
"822","group_9021","DUF1706 domain-containing protein","",2,11,0.909090909090909,"GROUP_9021 DUF1706 DOMAIN-CONTAINING PROTEIN ",FALSE,FALSE,FALSE,0,0
"823","holB","DNA polymerase III delta' subunit","",2,11,0.909090909090909,"HOLB DNA POLYMERASE III DELTA' SUBUNIT ",FALSE,FALSE,FALSE,0,0
"824","hsdM","type I restriction modification enzyme methylase subunit","",2,11,0.909090909090909,"HSDM TYPE I RESTRICTION MODIFICATION ENZYME METHYLASE SUBUNIT ",FALSE,FALSE,FALSE,0,0
"825","lytC","14-beta-N-acetylmuramidase","",2,11,0.909090909090909,"LYTC 14-BETA-N-ACETYLMURAMIDASE ",FALSE,FALSE,FALSE,0,0
"826","metN","ABC transporter ATP-binding protein","",2,11,0.909090909090909,"METN ABC TRANSPORTER ATP-BINDING PROTEIN ",FALSE,FALSE,FALSE,0,0
"827","murC_1","UDP-N-acetylmuramate--L-alanine ligase","",2,11,0.909090909090909,"MURC_1 UDP-N-ACETYLMURAMATE--L-ALANINE LIGASE ",FALSE,FALSE,FALSE,0,0
"828","nikS","nikkomycin biosynthesis protein carboxylase","",2,11,0.909090909090909,"NIKS NIKKOMYCIN BIOSYNTHESIS PROTEIN CARBOXYLASE ",FALSE,FALSE,FALSE,0,0
"829","pncO","metal-dependent CAAX amino terminal membrane protease","",2,11,0.909090909090909,"PNCO METAL-DEPENDENT CAAX AMINO TERMINAL MEMBRANE PROTEASE ",FALSE,FALSE,FALSE,0,0
"830","ppsA_1","bacitracin synthetase 1 BacA","",2,11,0.909090909090909,"PPSA_1 BACITRACIN SYNTHETASE 1 BACA ",FALSE,FALSE,FALSE,0,0
"831","vanUG2","vanUG2","",2,11,0.909090909090909,"VANUG2 VANUG2 ",FALSE,FALSE,FALSE,0,0
"832","group_17366","threonine dehydratase","ilvA",5,27,0.892561983471074,"GROUP_17366 THREONINE DEHYDRATASE ILVA",FALSE,FALSE,FALSE,0,0
"833","group_2028","protein LacX plasmid","",5,27,0.892561983471074,"GROUP_2028 PROTEIN LACX PLASMID ",FALSE,FALSE,FALSE,0,0
"834","ilvA","threonine dehydratase","",5,27,0.892561983471074,"ILVA THREONINE DEHYDRATASE ",FALSE,FALSE,FALSE,0,0
"835","ptsI","Phosphoenolpyruvate-protein phosphotransferase of PTS system","",5,27,0.892561983471074,"PTSI PHOSPHOENOLPYRUVATE-PROTEIN PHOSPHOTRANSFERASE OF PTS SYSTEM ",FALSE,FALSE,FALSE,0,0
"836","group_1383","cell wall surface anchor family protein","",9,48,0.881542699724518,"GROUP_1383 CELL WALL SURFACE ANCHOR FAMILY PROTEIN ",FALSE,FALSE,FALSE,0,0
"837","group_4063","competence factor transporting ATP-binding protein/permease ComA","comA",6,32,0.881542699724518,"GROUP_4063 COMPETENCE FACTOR TRANSPORTING ATP-BINDING PROTEIN/PERMEASE COMA COMA",FALSE,FALSE,FALSE,0,0
"838","ydaF_1","acetyltransferase GNAT family protein","",6,32,0.881542699724518,"YDAF_1 ACETYLTRANSFERASE GNAT FAMILY PROTEIN ",FALSE,FALSE,FALSE,0,0
"839","capD","nucleoside-diphosphate sugar isomerase","",3,16,0.881542699724518,"CAPD NUCLEOSIDE-DIPHOSPHATE SUGAR ISOMERASE ",FALSE,FALSE,FALSE,0,0
"840","cmtB","transcriptional regulator BglG family","",3,16,0.881542699724518,"CMTB TRANSCRIPTIONAL REGULATOR BGLG FAMILY ",FALSE,FALSE,FALSE,0,0
"841","ecfA1_2","ABC transporter ATP-binding protein","",3,16,0.881542699724518,"ECFA1_2 ABC TRANSPORTER ATP-BINDING PROTEIN ",FALSE,FALSE,FALSE,0,0
"842","group_11206","ABC transporter substrate-binding protein","yesO_3",3,16,0.881542699724518,"GROUP_11206 ABC TRANSPORTER SUBSTRATE-BINDING PROTEIN YESO_3",FALSE,FALSE,FALSE,0,0
"843","group_11239","putative conjugative transposon protein","",3,16,0.881542699724518,"GROUP_11239 PUTATIVE CONJUGATIVE TRANSPOSON PROTEIN ",FALSE,FALSE,FALSE,0,0
"844","group_11740","Mobile element protein","Int-Tn_2",3,16,0.881542699724518,"GROUP_11740 MOBILE ELEMENT PROTEIN INT-TN_2",FALSE,FALSE,FALSE,0,0
"845","group_12067","ATP-dependent Clp protease ATP-binding subunit","clpC_2",3,16,0.881542699724518,"GROUP_12067 ATP-DEPENDENT CLP PROTEASE ATP-BINDING SUBUNIT CLPC_2",FALSE,FALSE,FALSE,0,0
"846","group_2519","serine/threonine protein kinase","",3,16,0.881542699724518,"GROUP_2519 SERINE/THREONINE PROTEIN KINASE ",FALSE,FALSE,FALSE,0,0
"847","group_4851","Esterase","",3,16,0.881542699724518,"GROUP_4851 ESTERASE ",FALSE,FALSE,FALSE,0,0
"848","hpdA","pyruvate formate-lyase 3","",3,16,0.881542699724518,"HPDA PYRUVATE FORMATE-LYASE 3 ",FALSE,FALSE,FALSE,0,0
"849","nanA_2","N-acetylneuraminate lyase","",3,16,0.881542699724518,"NANA_2 N-ACETYLNEURAMINATE LYASE ",FALSE,FALSE,FALSE,0,0
"850","artM_1","ABC transporter ATP-binding protein","",4,21,0.867768595041322,"ARTM_1 ABC TRANSPORTER ATP-BINDING PROTEIN ",FALSE,FALSE,FALSE,0,0
"851","artM_3","ABC transporter ATP-binding protein","",4,21,0.867768595041322,"ARTM_3 ABC TRANSPORTER ATP-BINDING PROTEIN ",FALSE,FALSE,FALSE,0,0
"852","group_4740","glyoxalase family protein superfamily","",4,21,0.867768595041322,"GROUP_4740 GLYOXALASE FAMILY PROTEIN SUPERFAMILY ",FALSE,FALSE,FALSE,0,0
"853","group_5316","transporter major facilitator family protein","",4,21,0.867768595041322,"GROUP_5316 TRANSPORTER MAJOR FACILITATOR FAMILY PROTEIN ",FALSE,FALSE,FALSE,0,0
"854","lytA_5","autolysin","",4,21,0.867768595041322,"LYTA_5 AUTOLYSIN ",FALSE,FALSE,FALSE,0,0
"855","group_3925","iron ABC transporter iron-binding protein","potD_1",5,26,0.859504132231405,"GROUP_3925 IRON ABC TRANSPORTER IRON-BINDING PROTEIN POTD_1",FALSE,FALSE,FALSE,0,0
"856","group_5211","methyltransferase small domain superfamily","ubiE",6,31,0.853994490358127,"GROUP_5211 METHYLTRANSFERASE SMALL DOMAIN SUPERFAMILY UBIE",FALSE,FALSE,FALSE,0,0
"857","group_5762","glycosyltransferase involved in cell wall biogenesis","kfoC_2",6,31,0.853994490358127,"GROUP_5762 GLYCOSYLTRANSFERASE INVOLVED IN CELL WALL BIOGENESIS KFOC_2",FALSE,FALSE,FALSE,0,0
"858","lytA_6","autolysin","",6,31,0.853994490358127,"LYTA_6 AUTOLYSIN ",FALSE,FALSE,FALSE,0,0
"859","group_1984","peptidase U32 family","yhbU_1",7,36,0.850059031877214,"GROUP_1984 PEPTIDASE U32 FAMILY YHBU_1",FALSE,FALSE,FALSE,0,0
"860","group_6621","DNA modification methyltransferase M.XbaI","yhdJ",7,36,0.850059031877214,"GROUP_6621 DNA MODIFICATION METHYLTRANSFERASE M.XBAI YHDJ",FALSE,FALSE,FALSE,0,0
"861","cglC","competence protein ComGC","",8,41,0.847107438016529,"CGLC COMPETENCE PROTEIN COMGC ",FALSE,FALSE,FALSE,0,0
"862","comGF","competence protein ComGF","",8,41,0.847107438016529,"COMGF COMPETENCE PROTEIN COMGF ",FALSE,FALSE,FALSE,0,0
"863","group_3438","RNA methyltransferase","rlmCD_2",8,41,0.847107438016529,"GROUP_3438 RNA METHYLTRANSFERASE RLMCD_2",FALSE,FALSE,FALSE,0,0
"864","group_4174","competence protein","cglC",8,41,0.847107438016529,"GROUP_4174 COMPETENCE PROTEIN CGLC",FALSE,FALSE,FALSE,0,0
"865","group_7067","competence protein ComGF","",8,41,0.847107438016529,"GROUP_7067 COMPETENCE PROTEIN COMGF ",FALSE,FALSE,FALSE,0,0
"866","group_9143","ornithine decarboxylase family protein","speA",8,41,0.847107438016529,"GROUP_9143 ORNITHINE DECARBOXYLASE FAMILY PROTEIN SPEA",FALSE,FALSE,FALSE,0,0
"867","rlmCD_2","RNA methyltransferase","",8,41,0.847107438016529,"RLMCD_2 RNA METHYLTRANSFERASE ",FALSE,FALSE,FALSE,0,0
"868","spoT","metal dependent phosphohydrolase HD region","",7,35,0.826446280991736,"SPOT METAL DEPENDENT PHOSPHOHYDROLASE HD REGION ",FALSE,FALSE,FALSE,0,0
"869","group_4182","competence factor transport protein ComB","comB",6,30,0.826446280991736,"GROUP_4182 COMPETENCE FACTOR TRANSPORT PROTEIN COMB COMB",FALSE,FALSE,FALSE,0,0
"870","group_4850","Esterase","",6,30,0.826446280991736,"GROUP_4850 ESTERASE ",FALSE,FALSE,FALSE,0,0
"871","group_6115","ABC transporter ATP-binding protein/permease","yheI_1",6,30,0.826446280991736,"GROUP_6115 ABC TRANSPORTER ATP-BINDING PROTEIN/PERMEASE YHEI_1",FALSE,FALSE,FALSE,0,0
"872","irtB","lantibiotic synthetase","",6,30,0.826446280991736,"IRTB LANTIBIOTIC SYNTHETASE ",FALSE,FALSE,FALSE,0,0
"873","Fucolectin-rel_2","repair protein","",5,25,0.826446280991736,"FUCOLECTIN-REL_2 REPAIR PROTEIN ",FALSE,FALSE,FALSE,0,0
"874","gidA_2","tRNA (uracil-5-)-methyltransferase Gid","",5,25,0.826446280991736,"GIDA_2 TRNA (URACIL-5-)-METHYLTRANSFERASE GID ",FALSE,FALSE,FALSE,0,0
"875","group_13045","Phosphoenolpyruvate-protein phosphotransferase of PTS system","ptsI",5,25,0.826446280991736,"GROUP_13045 PHOSPHOENOLPYRUVATE-PROTEIN PHOSPHOTRANSFERASE OF PTS SYSTEM PTSI",FALSE,FALSE,FALSE,0,0
"876","group_13673","membrane spanning protein","yjjP",5,25,0.826446280991736,"GROUP_13673 MEMBRANE SPANNING PROTEIN YJJP",FALSE,FALSE,FALSE,0,0
"877","group_4765","esterase","",5,25,0.826446280991736,"GROUP_4765 ESTERASE ",FALSE,FALSE,FALSE,0,0
"878","group_6643","surface anchored protein","",5,25,0.826446280991736,"GROUP_6643 SURFACE ANCHORED PROTEIN ",FALSE,FALSE,FALSE,0,0
"879","group_11931","excreted peptide","",4,20,0.826446280991736,"GROUP_11931 EXCRETED PEPTIDE ",FALSE,FALSE,FALSE,0,0
