"","Gene","Annotation","Non.unique.Gene.name","sg_change_0","sg_change_1","ratio","gene.annotate","phage","hypothetical","transposase","caps","exclude"
"880","group_2094","competence-specific global transcription modulator","",4,20,0.826446280991736,"GROUP_2094 COMPETENCE-SPECIFIC GLOBAL TRANSCRIPTION MODULATOR ",FALSE,FALSE,FALSE,0,0
"881","group_4734","glyoxalase-like protein","",4,20,0.826446280991736,"GROUP_4734 GLYOXALASE-LIKE PROTEIN ",FALSE,FALSE,FALSE,0,0
"882","fucA","L-fuculose phosphate aldolase","",3,15,0.826446280991736,"FUCA L-FUCULOSE PHOSPHATE ALDOLASE ",FALSE,FALSE,FALSE,0,0
"883","group_10187","cobalt transport protein","ykoC",3,15,0.826446280991736,"GROUP_10187 COBALT TRANSPORT PROTEIN YKOC",FALSE,FALSE,FALSE,0,0
"884","group_13758","N-acetylglucosamine-6-phosphate deacetylase","nagA",3,15,0.826446280991736,"GROUP_13758 N-ACETYLGLUCOSAMINE-6-PHOSPHATE DEACETYLASE NAGA",FALSE,FALSE,FALSE,0,0
"885","group_3687","pyrrolidone-carboxylate peptidase (5-oxoprolyl-peptidase)","pcp_2",3,15,0.826446280991736,"GROUP_3687 PYRROLIDONE-CARBOXYLATE PEPTIDASE (5-OXOPROLYL-PEPTIDASE) PCP_2",FALSE,FALSE,FALSE,0,0
"886","nagA","N-acetylglucosamine-6-phosphate deacetylase","",3,15,0.826446280991736,"NAGA N-ACETYLGLUCOSAMINE-6-PHOSPHATE DEACETYLASE ",FALSE,FALSE,FALSE,0,0
"887","phtE_1","pneumococcal histidine triad protein E","",3,15,0.826446280991736,"PHTE_1 PNEUMOCOCCAL HISTIDINE TRIAD PROTEIN E ",FALSE,FALSE,FALSE,0,0
"888","group_10274","Beta glucanase","glcA",2,10,0.826446280991736,"GROUP_10274 BETA GLUCANASE GLCA",FALSE,FALSE,FALSE,0,0
"889","group_10312","deacylase","dapE",2,10,0.826446280991736,"GROUP_10312 DEACYLASE DAPE",FALSE,FALSE,FALSE,0,0
"890","group_11157","DNA repair protein","radA",2,10,0.826446280991736,"GROUP_11157 DNA REPAIR PROTEIN RADA",FALSE,FALSE,FALSE,0,0
"891","group_11485","alpha-L-fucosidase","",2,10,0.826446280991736,"GROUP_11485 ALPHA-L-FUCOSIDASE ",FALSE,FALSE,FALSE,0,0
"892","group_11620","ABC transporter substrate-binding lipoprotein","tcyA_2",2,10,0.826446280991736,"GROUP_11620 ABC TRANSPORTER SUBSTRATE-BINDING LIPOPROTEIN TCYA_2",FALSE,FALSE,FALSE,0,0
"893","group_11818","transporter major facilitator family protein","",2,10,0.826446280991736,"GROUP_11818 TRANSPORTER MAJOR FACILITATOR FAMILY PROTEIN ",FALSE,FALSE,FALSE,0,0
"894","group_12433","Uncharacterized protein conserved in bacteria","",2,10,0.826446280991736,"GROUP_12433 UNCHARACTERIZED PROTEIN CONSERVED IN BACTERIA ",FALSE,FALSE,FALSE,0,0
"895","group_13747","major facilitator superfamily permease","",2,10,0.826446280991736,"GROUP_13747 MAJOR FACILITATOR SUPERFAMILY PERMEASE ",FALSE,FALSE,FALSE,0,0
"896","group_13748","major facilitator superfamily permease","",2,10,0.826446280991736,"GROUP_13748 MAJOR FACILITATOR SUPERFAMILY PERMEASE ",FALSE,FALSE,FALSE,0,0
"897","group_15241","L-fuculose phosphate aldolase","fucA",2,10,0.826446280991736,"GROUP_15241 L-FUCULOSE PHOSPHATE ALDOLASE FUCA",FALSE,FALSE,FALSE,0,0
"898","group_15441","ROK family protein putative","mlc",2,10,0.826446280991736,"GROUP_15441 ROK FAMILY PROTEIN PUTATIVE MLC",FALSE,FALSE,FALSE,0,0
"899","group_15959","putative site-specific recombinase","",2,10,0.826446280991736,"GROUP_15959 PUTATIVE SITE-SPECIFIC RECOMBINASE ",FALSE,FALSE,FALSE,0,0
"900","group_16763","protein Ymh","",2,10,0.826446280991736,"GROUP_16763 PROTEIN YMH ",FALSE,FALSE,FALSE,0,0
"901","group_4023","AzlC family protein","ygaZ",2,10,0.826446280991736,"GROUP_4023 AZLC FAMILY PROTEIN YGAZ",FALSE,FALSE,FALSE,0,0
"902","group_5076","glucose-1-phosphate adenylyltransferase","glgC",2,10,0.826446280991736,"GROUP_5076 GLUCOSE-1-PHOSPHATE ADENYLYLTRANSFERASE GLGC",FALSE,FALSE,FALSE,0,0
"903","group_5345","high-affinity Fe2+/Pb2+ permease","",2,10,0.826446280991736,"GROUP_5345 HIGH-AFFINITY FE2+/PB2+ PERMEASE ",FALSE,FALSE,FALSE,0,0
"904","group_6417","30S ribosomal protein S4","rpsD",2,10,0.826446280991736,"GROUP_6417 30S RIBOSOMAL PROTEIN S4 RPSD",FALSE,FALSE,FALSE,0,0
"905","group_7159","sensor histidine kinase","ypdA",2,10,0.826446280991736,"GROUP_7159 SENSOR HISTIDINE KINASE YPDA",FALSE,FALSE,FALSE,0,0
"906","group_7349","transcriptional activator Rgg/GadR/MutR family protein","",2,10,0.826446280991736,"GROUP_7349 TRANSCRIPTIONAL ACTIVATOR RGG/GADR/MUTR FAMILY PROTEIN ",FALSE,FALSE,FALSE,0,0
"907","group_7954","transcriptional regulator","",2,10,0.826446280991736,"GROUP_7954 TRANSCRIPTIONAL REGULATOR ",FALSE,FALSE,FALSE,0,0
"908","group_8354","methyltransferase","",2,10,0.826446280991736,"GROUP_8354 METHYLTRANSFERASE ",FALSE,FALSE,FALSE,0,0
"909","group_8480","amino acid permease family protein","yfnA",2,10,0.826446280991736,"GROUP_8480 AMINO ACID PERMEASE FAMILY PROTEIN YFNA",FALSE,FALSE,FALSE,0,0
"910","group_8529","purine nucleoside phosphorylase","punA",2,10,0.826446280991736,"GROUP_8529 PURINE NUCLEOSIDE PHOSPHORYLASE PUNA",FALSE,FALSE,FALSE,0,0
"911","group_9020","DUF1706 domain-containing protein","",2,10,0.826446280991736,"GROUP_9020 DUF1706 DOMAIN-CONTAINING PROTEIN ",FALSE,FALSE,FALSE,0,0
"912","group_9366","integral membrane protein","",2,10,0.826446280991736,"GROUP_9366 INTEGRAL MEMBRANE PROTEIN ",FALSE,FALSE,FALSE,0,0
"913","group_9532","ABC transporter permease","metP",2,10,0.826446280991736,"GROUP_9532 ABC TRANSPORTER PERMEASE METP",FALSE,FALSE,FALSE,0,0
"914","group_9707","phosphoribosylformylglycinamidine synthase II (FGAM synthetase)","purL",2,10,0.826446280991736,"GROUP_9707 PHOSPHORIBOSYLFORMYLGLYCINAMIDINE SYNTHASE II (FGAM SYNTHETASE) PURL",FALSE,FALSE,FALSE,0,0
"915","IS1381-truncation_2","mobile genetic element","",2,10,0.826446280991736,"IS1381-TRUNCATION_2 MOBILE GENETIC ELEMENT ",FALSE,FALSE,FALSE,0,0
"916","malR","maltose operon transcriptional repressor","",2,10,0.826446280991736,"MALR MALTOSE OPERON TRANSCRIPTIONAL REPRESSOR ",FALSE,FALSE,FALSE,0,0
"917","punA","purine nucleoside phosphorylase","",2,10,0.826446280991736,"PUNA PURINE NUCLEOSIDE PHOSPHORYLASE ",FALSE,FALSE,FALSE,0,0
"918","rafA","alpha-galactosidase AgaN","",2,10,0.826446280991736,"RAFA ALPHA-GALACTOSIDASE AGAN ",FALSE,FALSE,FALSE,0,0
"919","tcyA_1","ABC transporter substrate-binding lipoprotein","",2,10,0.826446280991736,"TCYA_1 ABC TRANSPORTER SUBSTRATE-BINDING LIPOPROTEIN ",FALSE,FALSE,FALSE,0,0
"920","tcyA_2","ABC transporter substrate-binding lipoprotein","",2,10,0.826446280991736,"TCYA_2 ABC TRANSPORTER SUBSTRATE-BINDING LIPOPROTEIN ",FALSE,FALSE,FALSE,0,0
"921","tcyB","amino acid ABC transporter permease","",2,10,0.826446280991736,"TCYB AMINO ACID ABC TRANSPORTER PERMEASE ",FALSE,FALSE,FALSE,0,0
"922","adh","alcohol dehydrogenase","",8,39,0.805785123966942,"ADH ALCOHOL DEHYDROGENASE ",FALSE,FALSE,FALSE,0,0
"923","group_12705","alcohol dehydrogenase","adh",8,39,0.805785123966942,"GROUP_12705 ALCOHOL DEHYDROGENASE ADH",FALSE,FALSE,FALSE,0,0
"924","group_1390","cell wall surface anchor family protein","",8,39,0.805785123966942,"GROUP_1390 CELL WALL SURFACE ANCHOR FAMILY PROTEIN ",FALSE,FALSE,FALSE,0,0
"925","group_998","immunoglobulin A1 protease","iga_2",8,39,0.805785123966942,"GROUP_998 IMMUNOGLOBULIN A1 PROTEASE IGA_2",FALSE,FALSE,FALSE,0,0
"926","dnaA","DNA biosynthesis initiation binding protein","",5,24,0.793388429752066,"DNAA DNA BIOSYNTHESIS INITIATION BINDING PROTEIN ",FALSE,FALSE,FALSE,0,0
"927","group_11115","membrane-fusion protein","",5,24,0.793388429752066,"GROUP_11115 MEMBRANE-FUSION PROTEIN ",FALSE,FALSE,FALSE,0,0
"928","group_11116","membrane-fusion protein","macB_4",5,24,0.793388429752066,"GROUP_11116 MEMBRANE-FUSION PROTEIN MACB_4",FALSE,FALSE,FALSE,0,0
"929","group_13890","undecaprenol kinase","bacA",5,24,0.793388429752066,"GROUP_13890 UNDECAPRENOL KINASE BACA",FALSE,FALSE,FALSE,0,0
"930","group_16694","DNA biosynthesis initiation binding protein","dnaA",5,24,0.793388429752066,"GROUP_16694 DNA BIOSYNTHESIS INITIATION BINDING PROTEIN DNAA",FALSE,FALSE,FALSE,0,0
"931","group_6776","PTS system mannitol-specific transporter subunit EIIBC","mtlA",5,24,0.793388429752066,"GROUP_6776 PTS SYSTEM MANNITOL-SPECIFIC TRANSPORTER SUBUNIT EIIBC MTLA",FALSE,FALSE,FALSE,0,0
"932","group_16699","XRE family transcriptional regulator","",4,19,0.785123966942149,"GROUP_16699 XRE FAMILY TRANSCRIPTIONAL REGULATOR ",FALSE,FALSE,FALSE,0,0
"933","group_4815","exported glycosyl hydrolase","",4,19,0.785123966942149,"GROUP_4815 EXPORTED GLYCOSYL HYDROLASE ",FALSE,FALSE,FALSE,0,0
"934","group_6273","alpha mannosidase","mngB",7,33,0.779220779220779,"GROUP_6273 ALPHA MANNOSIDASE MNGB",FALSE,FALSE,FALSE,0,0
"935","group_15157","ABC transporter-sugar transport N-acetylneuraminate transport system permease","ycjP_4",6,28,0.771349862258953,"GROUP_15157 ABC TRANSPORTER-SUGAR TRANSPORT N-ACETYLNEURAMINATE TRANSPORT SYSTEM PERMEASE YCJP_4",FALSE,FALSE,FALSE,0,0
"936","group_2646","PTS system galactose-specific transporter subunit IIB","lepA",6,28,0.771349862258953,"GROUP_2646 PTS SYSTEM GALACTOSE-SPECIFIC TRANSPORTER SUBUNIT IIB LEPA",FALSE,FALSE,FALSE,0,0
"937","group_6638","surface anchored protein","",6,28,0.771349862258953,"GROUP_6638 SURFACE ANCHORED PROTEIN ",FALSE,FALSE,FALSE,0,0
"938","group_8543","recombination regulator RecX","",6,28,0.771349862258953,"GROUP_8543 RECOMBINATION REGULATOR RECX ",FALSE,FALSE,FALSE,0,0
"939","ycjP_3","ABC transporter-sugar transport N-acetylneuraminate transport system permease","",6,28,0.771349862258953,"YCJP_3 ABC TRANSPORTER-SUGAR TRANSPORT N-ACETYLNEURAMINATE TRANSPORT SYSTEM PERMEASE ",FALSE,FALSE,FALSE,0,0
"940","adcA","ABC zinc transporter metal-binding lipoprotein","",3,14,0.771349862258953,"ADCA ABC ZINC TRANSPORTER METAL-BINDING LIPOPROTEIN ",FALSE,FALSE,FALSE,0,0
"941","dpnC","type II restriction endonuclease DpnI","",3,14,0.771349862258953,"DPNC TYPE II RESTRICTION ENDONUCLEASE DPNI ",FALSE,FALSE,FALSE,0,0
"942","gldA","3-dehydroquinate synthase","",3,14,0.771349862258953,"GLDA 3-DEHYDROQUINATE SYNTHASE ",FALSE,FALSE,FALSE,0,0
"943","group_1101","lytic amidase (N-acetylmuramoyl-L-alanine amidase)","lytA_5",3,14,0.771349862258953,"GROUP_1101 LYTIC AMIDASE (N-ACETYLMURAMOYL-L-ALANINE AMIDASE) LYTA_5",FALSE,FALSE,FALSE,0,0
"944","group_11585","integral membrane protein","",3,14,0.771349862258953,"GROUP_11585 INTEGRAL MEMBRANE PROTEIN ",FALSE,FALSE,FALSE,0,0
"945","group_2498","Ser/Thr protein phosphatase family protein","",3,14,0.771349862258953,"GROUP_2498 SER/THR PROTEIN PHOSPHATASE FAMILY PROTEIN ",FALSE,FALSE,FALSE,0,0
"946","group_6166","Pneumococcal histidine triad protein D precursor","",3,14,0.771349862258953,"GROUP_6166 PNEUMOCOCCAL HISTIDINE TRIAD PROTEIN D PRECURSOR ",FALSE,FALSE,FALSE,0,0
"947","group_8545","recombination regulator RecX","",3,14,0.771349862258953,"GROUP_8545 RECOMBINATION REGULATOR RECX ",FALSE,FALSE,FALSE,0,0
"948","group_8623","amino acid ABC transporter amino acid-binding protein","tcyJ",3,14,0.771349862258953,"GROUP_8623 AMINO ACID ABC TRANSPORTER AMINO ACID-BINDING PROTEIN TCYJ",FALSE,FALSE,FALSE,0,0
"949","group_8718","serine/threonine protein phosphatase","pphA",3,14,0.771349862258953,"GROUP_8718 SERINE/THREONINE PROTEIN PHOSPHATASE PPHA",FALSE,FALSE,FALSE,0,0
"950","hhaIM","DNA modification methylase","",3,14,0.771349862258953,"HHAIM DNA MODIFICATION METHYLASE ",FALSE,FALSE,FALSE,0,0
"951","lafA","BlpM","",3,14,0.771349862258953,"LAFA BLPM ",FALSE,FALSE,FALSE,0,0
"952","PTS-EII_1","PTS system IIA component","",3,14,0.771349862258953,"PTS-EII_1 PTS SYSTEM IIA COMPONENT ",FALSE,FALSE,FALSE,0,0
"953","tcyJ","amino acid ABC transporter amino acid-binding protein","",3,14,0.771349862258953,"TCYJ AMINO ACID ABC TRANSPORTER AMINO ACID-BINDING PROTEIN ",FALSE,FALSE,FALSE,0,0
"954","afr","Gfo/Idh/MocA family oxidoreductase","",5,23,0.760330578512397,"AFR GFO/IDH/MOCA FAMILY OXIDOREDUCTASE ",FALSE,FALSE,FALSE,0,0
"955","group_1478","choline binding protein PcpA","pcpA",5,23,0.760330578512397,"GROUP_1478 CHOLINE BINDING PROTEIN PCPA PCPA",FALSE,FALSE,FALSE,0,0
"956","group_16374","glyceraldehyde-3-phosphate dehydrogenase","gapA",5,23,0.760330578512397,"GROUP_16374 GLYCERALDEHYDE-3-PHOSPHATE DEHYDROGENASE GAPA",FALSE,FALSE,FALSE,0,0
"957","group_18294","transcription termination factor","",5,23,0.760330578512397,"GROUP_18294 TRANSCRIPTION TERMINATION FACTOR ",FALSE,FALSE,FALSE,0,0
"958","mtlA","PTS system mannitol-specific transporter subunit EIIBC","",5,23,0.760330578512397,"MTLA PTS SYSTEM MANNITOL-SPECIFIC TRANSPORTER SUBUNIT EIIBC ",FALSE,FALSE,FALSE,0,0
"959","potA_2","ferric cations import ATP-binding protein FbpC","",7,32,0.755608028335301,"POTA_2 FERRIC CATIONS IMPORT ATP-BINDING PROTEIN FBPC ",FALSE,FALSE,FALSE,0,0
"960","group_5951","Membrane protein","",6,27,0.743801652892562,"GROUP_5951 MEMBRANE PROTEIN ",FALSE,FALSE,FALSE,0,0
"961","group_421","mobile genetic element","IS1381-truncation",10,45,0.743801652892562,"GROUP_421 MOBILE GENETIC ELEMENT IS1381-TRUNCATION",FALSE,FALSE,FALSE,0,0
"962","dnaQ","DNA polymerase III subunit epsilon","",4,18,0.743801652892562,"DNAQ DNA POLYMERASE III SUBUNIT EPSILON ",FALSE,FALSE,FALSE,0,0
"963","group_10155","binding-protein-dependent transport systems inner membrane component","potH",4,18,0.743801652892562,"GROUP_10155 BINDING-PROTEIN-DEPENDENT TRANSPORT SYSTEMS INNER MEMBRANE COMPONENT POTH",FALSE,FALSE,FALSE,0,0
"964","group_13394","DNA polymerase III subunit epsilon","dnaQ",4,18,0.743801652892562,"GROUP_13394 DNA POLYMERASE III SUBUNIT EPSILON DNAQ",FALSE,FALSE,FALSE,0,0
"965","group_2298","PTS system transporter subunit IIA","",4,18,0.743801652892562,"GROUP_2298 PTS SYSTEM TRANSPORTER SUBUNIT IIA ",FALSE,FALSE,FALSE,0,0
"966","group_6705","sucrose-6-phosphate hydrolase","sacA",4,18,0.743801652892562,"GROUP_6705 SUCROSE-6-PHOSPHATE HYDROLASE SACA",FALSE,FALSE,FALSE,0,0
"967","group_7131","transcriptional activator","atxA",4,18,0.743801652892562,"GROUP_7131 TRANSCRIPTIONAL ACTIVATOR ATXA",FALSE,FALSE,FALSE,0,0
"968","lmb","adhesion lipoprotein","",4,18,0.743801652892562,"LMB ADHESION LIPOPROTEIN ",FALSE,FALSE,FALSE,0,0
"969","resA","thioredoxin","",4,18,0.743801652892562,"RESA THIOREDOXIN ",FALSE,FALSE,FALSE,0,0
"970","group_10296","beta-galactosidase subunit beta","tabA_2",2,9,0.743801652892562,"GROUP_10296 BETA-GALACTOSIDASE SUBUNIT BETA TABA_2",FALSE,FALSE,FALSE,0,0
"971","group_12432","Uncharacterized protein conserved in bacteria","",2,9,0.743801652892562,"GROUP_12432 UNCHARACTERIZED PROTEIN CONSERVED IN BACTERIA ",FALSE,FALSE,FALSE,0,0
"972","group_1285","TMP repeat family","yqbO",2,9,0.743801652892562,"GROUP_1285 TMP REPEAT FAMILY YQBO",FALSE,FALSE,FALSE,0,0
"973","group_16191","phosphatidylglycerophosphatase A","pgpA",2,9,0.743801652892562,"GROUP_16191 PHOSPHATIDYLGLYCEROPHOSPHATASE A PGPA",FALSE,FALSE,FALSE,0,0
"974","group_2312","PTS system transporter subunit IIA","",2,9,0.743801652892562,"GROUP_2312 PTS SYSTEM TRANSPORTER SUBUNIT IIA ",FALSE,FALSE,FALSE,0,0
"975","group_4540","D-alanyl carrier protein DCP","dltC",2,9,0.743801652892562,"GROUP_4540 D-ALANYL CARRIER PROTEIN DCP DLTC",FALSE,FALSE,FALSE,0,0
"976","group_4642","amino acid ABC transporter permease","artQ_2",2,9,0.743801652892562,"GROUP_4642 AMINO ACID ABC TRANSPORTER PERMEASE ARTQ_2",FALSE,FALSE,FALSE,0,0
"977","group_4643","amino acid ABC transporter permease","artQ_1",2,9,0.743801652892562,"GROUP_4643 AMINO ACID ABC TRANSPORTER PERMEASE ARTQ_1",FALSE,FALSE,FALSE,0,0
"978","group_5269","alpha-galactosidase","agaN",2,9,0.743801652892562,"GROUP_5269 ALPHA-GALACTOSIDASE AGAN",FALSE,FALSE,FALSE,0,0
"979","group_6448","Bacteriocin ABC transoporter","lagD_1",2,9,0.743801652892562,"GROUP_6448 BACTERIOCIN ABC TRANSOPORTER LAGD_1",FALSE,FALSE,FALSE,0,0
"980","group_7374","gamma-glutamylcysteine synthetase putative","",2,9,0.743801652892562,"GROUP_7374 GAMMA-GLUTAMYLCYSTEINE SYNTHETASE PUTATIVE ",FALSE,FALSE,FALSE,0,0
"981","group_8078","trehalose operon repressor","treR",2,9,0.743801652892562,"GROUP_8078 TREHALOSE OPERON REPRESSOR TRER",FALSE,FALSE,FALSE,0,0
"982","group_9023","Helicase","",2,9,0.743801652892562,"GROUP_9023 HELICASE ",FALSE,FALSE,FALSE,0,0
"983","group_9933","BlpM","lafA",2,9,0.743801652892562,"GROUP_9933 BLPM LAFA",FALSE,FALSE,FALSE,0,0
"984","gsiB","oligopeptide ABC transporteroligopeptide-binding protein","",2,9,0.743801652892562,"GSIB OLIGOPEPTIDE ABC TRANSPORTEROLIGOPEPTIDE-BINDING PROTEIN ",FALSE,FALSE,FALSE,0,0
"985","pgpA","phosphatidylglycerophosphatase A","",2,9,0.743801652892562,"PGPA PHOSPHATIDYLGLYCEROPHOSPHATASE A ",FALSE,FALSE,FALSE,0,0
"986","tabA_2","beta-galactosidase subunit beta","",2,9,0.743801652892562,"TABA_2 BETA-GALACTOSIDASE SUBUNIT BETA ",FALSE,FALSE,FALSE,0,0
"987","tadA","cytidine/deoxycytidylate deaminase","",2,9,0.743801652892562,"TADA CYTIDINE/DEOXYCYTIDYLATE DEAMINASE ",FALSE,FALSE,FALSE,0,0
"988","thiE_2","thiamine-phosphate pyrophosphorylase","",2,9,0.743801652892562,"THIE_2 THIAMINE-PHOSPHATE PYROPHOSPHORYLASE ",FALSE,FALSE,FALSE,0,0
"989","group_11821","hydrolase","yihX",7,31,0.731995277449823,"GROUP_11821 HYDROLASE YIHX",FALSE,FALSE,FALSE,0,0
"990","fbpC","ATP-binding component of ABC transporter","",5,22,0.727272727272727,"FBPC ATP-BINDING COMPONENT OF ABC TRANSPORTER ",FALSE,FALSE,FALSE,0,0
"991","group_1063","autolysin","lytA_1",5,22,0.727272727272727,"GROUP_1063 AUTOLYSIN LYTA_1",FALSE,FALSE,FALSE,0,0
"992","group_4022","branched-chain amino acid permease","ygaZ",5,22,0.727272727272727,"GROUP_4022 BRANCHED-CHAIN AMINO ACID PERMEASE YGAZ",FALSE,FALSE,FALSE,0,0
"993","group_497","type I restriction-modification system S protein","hsdS_1",5,22,0.727272727272727,"GROUP_497 TYPE I RESTRICTION-MODIFICATION SYSTEM S PROTEIN HSDS_1",FALSE,FALSE,FALSE,0,0
"994","yjjP","membrane spanning protein","",6,26,0.716253443526171,"YJJP MEMBRANE SPANNING PROTEIN ",FALSE,FALSE,FALSE,0,0
"995","agaN","alpha-galactosidase","",3,13,0.716253443526171,"AGAN ALPHA-GALACTOSIDASE ",FALSE,FALSE,FALSE,0,0
"996","aliA","oligopeptide ABC transporter oligopeptide-binding protein AliA","",3,13,0.716253443526171,"ALIA OLIGOPEPTIDE ABC TRANSPORTER OLIGOPEPTIDE-BINDING PROTEIN ALIA ",FALSE,FALSE,FALSE,0,0
"997","btr","AraC family transcriptional regulator","",3,13,0.716253443526171,"BTR ARAC FAMILY TRANSCRIPTIONAL REGULATOR ",FALSE,FALSE,FALSE,0,0
"998","clpC_2","ATP-dependent Clp protease ATP-binding subunit","",3,13,0.716253443526171,"CLPC_2 ATP-DEPENDENT CLP PROTEASE ATP-BINDING SUBUNIT ",FALSE,FALSE,FALSE,0,0
"999","group_14871","nucleoside-diphosphate sugar isomerase","capD",3,13,0.716253443526171,"GROUP_14871 NUCLEOSIDE-DIPHOSPHATE SUGAR ISOMERASE CAPD",FALSE,FALSE,FALSE,0,0
"1000","group_5311","cell wall surface anchor family protein","spaP",3,13,0.716253443526171,"GROUP_5311 CELL WALL SURFACE ANCHOR FAMILY PROTEIN SPAP",FALSE,FALSE,FALSE,0,0
"1001","group_5664","Cof family protein","ybjI",3,13,0.716253443526171,"GROUP_5664 COF FAMILY PROTEIN YBJI",FALSE,FALSE,FALSE,0,0
"1002","group_6243","Phage protein","",3,13,0.716253443526171,"GROUP_6243 PHAGE PROTEIN ",FALSE,FALSE,FALSE,0,0
"1003","pcpA","choline binding protein PcpA","",3,13,0.716253443526171,"PCPA CHOLINE BINDING PROTEIN PCPA ",FALSE,FALSE,FALSE,0,0
"1004","ybjI","Cof family protein","",3,13,0.716253443526171,"YBJI COF FAMILY PROTEIN ",FALSE,FALSE,FALSE,0,0
"1005","group_424","mobile genetic element","IS1381-truncation",7,30,0.708382526564345,"GROUP_424 MOBILE GENETIC ELEMENT IS1381-TRUNCATION",FALSE,FALSE,FALSE,0,0
"1006","cglB","competence protein","",8,34,0.702479338842975,"CGLB COMPETENCE PROTEIN ",FALSE,FALSE,FALSE,0,0
"1007","comGG","late competence protein ComGG","",8,34,0.702479338842975,"COMGG LATE COMPETENCE PROTEIN COMGG ",FALSE,FALSE,FALSE,0,0
"1008","group_3569","competence protein","cglB",8,34,0.702479338842975,"GROUP_3569 COMPETENCE PROTEIN CGLB",FALSE,FALSE,FALSE,0,0
"1009","group_5755","late competence protein ComGG","comGG",8,34,0.702479338842975,"GROUP_5755 LATE COMPETENCE PROTEIN COMGG COMGG",FALSE,FALSE,FALSE,0,0
"1010","group_11314","membrane protein","",4,17,0.702479338842975,"GROUP_11314 MEMBRANE PROTEIN ",FALSE,FALSE,FALSE,0,0
"1011","group_11315","membrane protein","",4,17,0.702479338842975,"GROUP_11315 MEMBRANE PROTEIN ",FALSE,FALSE,FALSE,0,0
"1012","group_14777","conserved structural protein putative","",4,17,0.702479338842975,"GROUP_14777 CONSERVED STRUCTURAL PROTEIN PUTATIVE ",FALSE,FALSE,FALSE,0,0
"1013","group_4006","oligopeptide binding lipoprotein","sarA_1",4,17,0.702479338842975,"GROUP_4006 OLIGOPEPTIDE BINDING LIPOPROTEIN SARA_1",FALSE,FALSE,FALSE,0,0
"1014","group_6271","alpha mannosidase","mngB",4,17,0.702479338842975,"GROUP_6271 ALPHA MANNOSIDASE MNGB",FALSE,FALSE,FALSE,0,0
"1015","group_6640","surface anchored protein","",4,17,0.702479338842975,"GROUP_6640 SURFACE ANCHORED PROTEIN ",FALSE,FALSE,FALSE,0,0
"1016","group_10447","Phage gp6-like head-tail connector protein","",5,21,0.694214876033058,"GROUP_10447 PHAGE GP6-LIKE HEAD-TAIL CONNECTOR PROTEIN ",FALSE,FALSE,FALSE,0,0
"1017","group_12897","MHP","",5,21,0.694214876033058,"GROUP_12897 MHP ",FALSE,FALSE,FALSE,0,0
"1018","group_3664","major facilitator superfamily permease","",6,25,0.68870523415978,"GROUP_3664 MAJOR FACILITATOR SUPERFAMILY PERMEASE ",FALSE,FALSE,FALSE,0,0
"1019","xlyA","LysM domain protein","",6,25,0.68870523415978,"XLYA LYSM DOMAIN PROTEIN ",FALSE,FALSE,FALSE,0,0
"1020","yihX","hydrolase","",7,29,0.684769775678867,"YIHX HYDROLASE ",FALSE,FALSE,FALSE,0,0
"1021","degA_1","transcriptional regulator","",8,33,0.681818181818182,"DEGA_1 TRANSCRIPTIONAL REGULATOR ",FALSE,FALSE,FALSE,0,0
"1022","group_11000","transcriptional regulator","degA_1",8,33,0.681818181818182,"GROUP_11000 TRANSCRIPTIONAL REGULATOR DEGA_1",FALSE,FALSE,FALSE,0,0
"1023","yvgN","25-diketo-D-gluconic acid reductase A","",8,32,0.661157024793388,"YVGN 25-DIKETO-D-GLUCONIC ACID REDUCTASE A ",FALSE,FALSE,FALSE,0,0
"1024","fsaA","fructose-6-phosphate aldolase","",6,24,0.661157024793388,"FSAA FRUCTOSE-6-PHOSPHATE ALDOLASE ",FALSE,FALSE,FALSE,0,0
"1025","group_13456","fructose-6-phosphate aldolase","fsaA",6,24,0.661157024793388,"GROUP_13456 FRUCTOSE-6-PHOSPHATE ALDOLASE FSAA",FALSE,FALSE,FALSE,0,0
"1026","amiE","peptide ABC transporter ATP-binding protein","",5,20,0.661157024793388,"AMIE PEPTIDE ABC TRANSPORTER ATP-BINDING PROTEIN ",FALSE,FALSE,FALSE,0,0
"1027","dsbD_2","cytochrome c-type biogenesis protein CcdA","",5,20,0.661157024793388,"DSBD_2 CYTOCHROME C-TYPE BIOGENESIS PROTEIN CCDA ",FALSE,FALSE,FALSE,0,0
"1028","gapA","glyceraldehyde-3-phosphate dehydrogenase","",5,20,0.661157024793388,"GAPA GLYCERALDEHYDE-3-PHOSPHATE DEHYDROGENASE ",FALSE,FALSE,FALSE,0,0
"1029","group_10265","peptide ABC transporter ATP-binding protein","amiE",5,20,0.661157024793388,"GROUP_10265 PEPTIDE ABC TRANSPORTER ATP-BINDING PROTEIN AMIE",FALSE,FALSE,FALSE,0,0
"1030","group_12235","cytochrome c-type biogenesis protein CcdA","dsbD_2",5,20,0.661157024793388,"GROUP_12235 CYTOCHROME C-TYPE BIOGENESIS PROTEIN CCDA DSBD_2",FALSE,FALSE,FALSE,0,0
"1031","group_9525","glutamate dehydrogenase","gdhA",5,20,0.661157024793388,"GROUP_9525 GLUTAMATE DEHYDROGENASE GDHA",FALSE,FALSE,FALSE,0,0
"1032","group_14103","Phage protein","",4,16,0.661157024793388,"GROUP_14103 PHAGE PROTEIN ",FALSE,FALSE,FALSE,0,0
"1033","group_4027","branched-chain amino acid permease","ygaZ",4,16,0.661157024793388,"GROUP_4027 BRANCHED-CHAIN AMINO ACID PERMEASE YGAZ",FALSE,FALSE,FALSE,0,0
"1034","group_4982","Plasmid pRiA4b ORF-3-like protein","",4,16,0.661157024793388,"GROUP_4982 PLASMID PRIA4B ORF-3-LIKE PROTEIN ",FALSE,FALSE,FALSE,0,0
"1035","group_641","type I restriction-modification system S subunit putative","xerC_1",4,16,0.661157024793388,"GROUP_641 TYPE I RESTRICTION-MODIFICATION SYSTEM S SUBUNIT PUTATIVE XERC_1",FALSE,FALSE,FALSE,0,0
"1036","group_7820","transcriptional regulator BglG family","cmtB",4,16,0.661157024793388,"GROUP_7820 TRANSCRIPTIONAL REGULATOR BGLG FAMILY CMTB",FALSE,FALSE,FALSE,0,0
"1037","prtP","serine protease","",4,16,0.661157024793388,"PRTP SERINE PROTEASE ",FALSE,FALSE,FALSE,0,0
"1038","yesO_3","ABC transporter substrate-binding protein","",4,16,0.661157024793388,"YESO_3 ABC TRANSPORTER SUBSTRATE-BINDING PROTEIN ",FALSE,FALSE,FALSE,0,0
"1039","adhB","alcohol dehydrogenase","",3,12,0.661157024793388,"ADHB ALCOHOL DEHYDROGENASE ",FALSE,FALSE,FALSE,0,0
"1040","group_1178","serine protease","prtP",3,12,0.661157024793388,"GROUP_1178 SERINE PROTEASE PRTP",FALSE,FALSE,FALSE,0,0
"1041","group_15619","domain of unknown function protein","",3,12,0.661157024793388,"GROUP_15619 DOMAIN OF UNKNOWN FUNCTION PROTEIN ",FALSE,FALSE,FALSE,0,0
"1042","group_4505","amino acid ABC transporter permease","tcyB",3,12,0.661157024793388,"GROUP_4505 AMINO ACID ABC TRANSPORTER PERMEASE TCYB",FALSE,FALSE,FALSE,0,0
"1043","group_4590","Membrane protein","argG",3,12,0.661157024793388,"GROUP_4590 MEMBRANE PROTEIN ARGG",FALSE,FALSE,FALSE,0,0
"1044","group_5026","L-fucose isomerase","fucI",3,12,0.661157024793388,"GROUP_5026 L-FUCOSE ISOMERASE FUCI",FALSE,FALSE,FALSE,0,0
"1045","group_5335","argininosuccinate synthase","argG",3,12,0.661157024793388,"GROUP_5335 ARGININOSUCCINATE SYNTHASE ARGG",FALSE,FALSE,FALSE,0,0
"1046","group_7812","DNA polymerase IV","dinP",3,12,0.661157024793388,"GROUP_7812 DNA POLYMERASE IV DINP",FALSE,FALSE,FALSE,0,0
"1047","group_7906","phosphoglycerate mutase family protein","",3,12,0.661157024793388,"GROUP_7906 PHOSPHOGLYCERATE MUTASE FAMILY PROTEIN ",FALSE,FALSE,FALSE,0,0
"1048","group_8422","lipase","",3,12,0.661157024793388,"GROUP_8422 LIPASE ",FALSE,FALSE,FALSE,0,0
"1049","group_8681","uracil DNA glycosylase","",3,12,0.661157024793388,"GROUP_8681 URACIL DNA GLYCOSYLASE ",FALSE,FALSE,FALSE,0,0
"1050","pspC","surface protein PspC","",3,12,0.661157024793388,"PSPC SURFACE PROTEIN PSPC ",FALSE,FALSE,FALSE,0,0
"1051","rgg","transcriptional activator Rgg/GadR/MutR family protein","",3,12,0.661157024793388,"RGG TRANSCRIPTIONAL ACTIVATOR RGG/GADR/MUTR FAMILY PROTEIN ",FALSE,FALSE,FALSE,0,0
"1052","apt","adenine phosphoribosyltransferase","",2,8,0.661157024793388,"APT ADENINE PHOSPHORIBOSYLTRANSFERASE ",FALSE,FALSE,FALSE,0,0
